<?xml version="1.0" encoding="UTF-8"?>
<!ELEMENT Exam (student+) >
<!ELEMENT student (name,sex,grade)>
	<!ATTLIST student
		id CDATA #REQUIRED
	>
<!ELEMENT name (#PCDATA)>
<!ELEMENT grade (#PCDATA)>
<!ELEMENT sex (#PCDATA)>

	 