<?xml version="1.0" encoding="UTF-8" standalone="no"?>
<!DOCTYPE Exam SYSTEM "D:\workspace\GradeManageSys\src\Student.dtd">
<Exam>
	<student id="1">
		<name>小明</name>
		<sex>男</sex>
		<grade>20</grade>
	</student>
	
	<student id="3">
		<name>小明</name>
		<sex>女</sex>
		<grade>87.0</grade>
	</student>
</Exam>